{
  "apiVersion": "powerfarm.specs/v0",
  "kind": "HeartimeContract",
  "metadata": {
    "id": "powerfarm.app/contract/heartime.coloured-places.census",
    "generation": 1,
    "subject": "powerfarm.app/app/coloured-places",
    "owner": "powerfarm.app/office/director"
  },
  "spec": {
    "obligationId": "census",
    "responsibility": {
      "id": "powerfarm.app/contract/exec.coloured-places.census",
      "generation": 1
    },
    "recurrence": {
      "anchor": "2026-09-16T08:00:00Z",
      "everySeconds": 60
    },
    "graceSeconds": 60,
    "catchUp": "latest",
    "maxBatch": 64,
    "overlap": "coalesce",
    "reviewAfterSeconds": 300,
    "handoff": {
      "id": "powerfarm.app/contract/exec.coloured-places.census",
      "generation": 1
    },
    "fallback": {
      "mode": "safe_mode",
      "reviewAfterSeconds": 300,
      "handoff": {
        "id": "powerfarm.app/contract/exec.build-powerfarm-recovery",
        "generation": 1
      }
    },
    "planning": {
      "planValidThrough": "2026-09-17T08:00:00Z",
      "nextPlanningReviewAt": "2026-09-16T20:00:00Z",
      "reviewEverySeconds": 3600,
      "handoff": {
        "id": "powerfarm.app/contract/exec.prepare-next-period",
        "generation": 1
      }
    }
  }
}
